{
  "schema_version": "fabric.content-object/v2",
  "tenant_id": "tenant-a",
  "run_id": "r-93347307304ecb0a9bb1b51ae90ac326",
  "operation_id": "0f4c2a7e-9b1d-4e3f-8a6c-5d2e1b0a9f8e",
  "provenance": "caller_reported",
  "boundary": "caller",
  "source_id": "s-c5aedfd8a3ee415e277e335bf1517ff4",
  "source_epoch": 4611686018427387905,
  "source_sequence": 7,
  "captured_at": "2026-10-19T09:00:00Z",
  "status": "stored",
  "encoding": "binary",
  "object_id": "6f5e4d3c-2b1a-4c9d-8e7f-6a5b4c3d2e1f",
  "role": "actor.identity",
  "media_type": "application/json",
  "content_encoding": "identity",
  "representation": "exact",
  "transformations": [],
  "source_byte_length": 47,
  "source_sha256": "sha256:e9f067ffb0a25d5f221a7c251fec33efd234e6f134ae1c58687e2d95b8c084c7",
  "stored_byte_length": 47,
  "stored_sha256": "sha256:e9f067ffb0a25d5f221a7c251fec33efd234e6f134ae1c58687e2d95b8c084c7",
  "ref": "file:///var/lib/fabric/tenant-a/evidence/6f5e4d3c-2b1a-4c9d-8e7f-6a5b4c3d2e1f"
}
