{
  "schema_version": "fabric.content-object/v2",
  "object_id": "obj-1",
  "tenant_id": "tenant-a",
  "run_id": "run-1",
  "operation_id": "op-1",
  "role": "artifact.after",
  "media_type": "application/octet-stream",
  "encoding": "binary",
  "representation": "exact",
  "transformations": [],
  "source_byte_length": 4,
  "source_sha256": "sha256:46a1fda4b60882b250ae85357e3b3e51fa7fe529c67f246b36eb16a702c7dfd6",
  "stored_byte_length": 4,
  "stored_sha256": "sha256:46a1fda4b60882b250ae85357e3b3e51fa7fe529c67f246b36eb16a702c7dfd6",
  "ref": "file:///tenant-a/obj-1",
  "provenance": "native",
  "boundary": "sandbox",
  "source_id": "sandbox-1",
  "source_epoch": 0,
  "source_sequence": 1,
  "captured_at": "2026-09-26T00:00:00Z",
  "status": "stored",
  "links": []
}
